{"$schema":"https://json-schema.org/draft/2020-12/schema","title":"Project Environment Profile","type":"object","additionalProperties":false,"required":["record_kind","schema_version","environment_profile_id","site_context_status","wordpress_context_ref","elementor_availability_ref","known_limitations","unresolved_gaps","not_proven_by_profile"],"properties":{"record_kind":{"const":"project_environment_profile"},"schema_version":{"type":"string","minLength":1},"environment_profile_id":{"type":"string","minLength":1},"kernel_pin":{"type":"object"},"site_context_status":{"type":"object","additionalProperties":false,"required":["status"],"properties":{"status":{"enum":["not_provided","declared_not_available","provided_unvalidated","provided_schema_valid","implemented_awaiting_fixture_validation","validated_fixture","collected_runtime_evidence","rejected_invalid","insufficient_evidence","not_applicable_with_reason"]},"reason":{"type":"string","minLength":1},"ref":{"type":"string","minLength":1},"details":{"type":"string","minLength":1}}},"wordpress_context_ref":{"type":"object","additionalProperties":false,"required":["status"],"properties":{"status":{"enum":["not_provided","declared_not_available","provided_unvalidated","provided_schema_valid","implemented_awaiting_fixture_validation","validated_fixture","collected_runtime_evidence","rejected_invalid","insufficient_evidence","not_applicable_with_reason"]},"reason":{"type":"string","minLength":1},"ref":{"type":"string","minLength":1},"details":{"type":"string","minLength":1}}},"elementor_availability_ref":{"type":"object","additionalProperties":false,"required":["status"],"properties":{"status":{"enum":["not_provided","declared_not_available","provided_unvalidated","provided_schema_valid","implemented_awaiting_fixture_validation","validated_fixture","collected_runtime_evidence","rejected_invalid","insufficient_evidence","not_applicable_with_reason"]},"reason":{"type":"string","minLength":1},"ref":{"type":"string","minLength":1},"details":{"type":"string","minLength":1}}},"known_limitations":{"type":"array","items":{"type":"string","minLength":1},"minItems":1},"unresolved_gaps":{"type":"array","items":{"type":"string","minLength":1}},"not_proven_by_profile":{"type":"array","items":{"enum":["production_ready","builder_executed","downstream_contract_enforced","official_docs_fully_covered","cross_repo_integrated","project_gate_integrated"]},"minItems":1},"assertions":{"type":"array","items":{"type":"string","minLength":1}}}}
