{"record_kind":"project_environment_profile","schema_version":"0.5.0","environment_profile_id":"env-profile-fixture-unknowns","kernel_pin":{"kernel_version":"0.1.0-mvk","kernel_source_commit":"2a764ea8c0ad79dfc8a7c9e75db1262d2bc65d9e","registry_manifest_ref":"kernel/registries/registry-manifest.v0.json","registry_manifest_sha256":"aaaaaaaaaaaaaaaaaaaaaaaaaaaaaaaaaaaaaaaaaaaaaaaaaaaaaaaaaaaaaaaa","compatibility_profile":{"profile_id":"fixture-profile","consumer_stage":"kernel-local-evidence-workspace-fixture"}},"site_context_status":{"status":"insufficient_evidence","reason":"No target project export is attached."},"wordpress_context_ref":{"status":"not_provided","reason":"No WordPress context evidence package is attached."},"elementor_availability_ref":{"status":"not_provided","reason":"No Elementor availability package is attached."},"known_limitations":["Fixture profile only; not a target project profile."],"unresolved_gaps":["WordPress version unknown.","Elementor feature availability unknown."],"not_proven_by_profile":["production_ready","builder_executed","downstream_contract_enforced","official_docs_fully_covered","cross_repo_integrated","project_gate_integrated"]}
